<?xml version="1.0" encoding="UTF-8"?>
<dataroot xmlns:od="urn:schemas-microsoft-com:officedata" xmlns:xsi="http://www.w3.org/2001/XMLSchema-instance"  xsi:noNamespaceSchemaLocation="Trait.xsd" generated="2017-09-09T18:01:58">
<Trait>
<ID>1</ID>
<TraitName>트레잇1</TraitName>
<ModValue>1</ModValue>
<ModType>2</ModType>
<Desc>트레잇설명1</Desc>
</Trait>
<Trait>
<ID>2</ID>
<TraitName>트레잇2</TraitName>
<ModValue>1</ModValue>
<ModType>4</ModType>
<Desc>트레잇설명2</Desc>
</Trait>
<Trait>
<ID>3</ID>
<TraitName>트레잇3</TraitName>
<ModValue>1</ModValue>
<ModType>9</ModType>
<Desc>트레잇설명3</Desc>
</Trait>
<Trait>
<ID>4</ID>
<TraitName>트레잇4</TraitName>
<ModValue>1</ModValue>
<ModType>9</ModType>
<Desc>트레잇설명4</Desc>
</Trait>
<Trait>
<ID>5</ID>
<TraitName>트레잇5</TraitName>
<ModValue>1</ModValue>
<ModType>14</ModType>
<Desc>트레잇설명5</Desc>
</Trait>
<Trait>
<ID>6</ID>
<TraitName>트레잇6</TraitName>
<ModValue>1</ModValue>
<ModType>4</ModType>
<Desc>트레잇설명6</Desc>
</Trait>
<Trait>
<ID>7</ID>
<TraitName>트레잇7</TraitName>
<ModValue>1</ModValue>
<ModType>10</ModType>
<Desc>트레잇설명7</Desc>
</Trait>
<Trait>
<ID>8</ID>
<TraitName>트레잇8</TraitName>
<ModValue>1</ModValue>
<ModType>9</ModType>
<Desc>트레잇설명8</Desc>
</Trait>
<Trait>
<ID>9</ID>
<TraitName>트레잇9</TraitName>
<ModValue>1</ModValue>
<ModType>4</ModType>
<Desc>트레잇설명9</Desc>
</Trait>
<Trait>
<ID>10</ID>
<TraitName>트레잇10</TraitName>
<ModValue>1</ModValue>
<ModType>14</ModType>
<Desc>트레잇설명10</Desc>
</Trait>
</dataroot>
